classif1,classif1_label,classif1_sort
age_cldversion_y5_17,Age (Child labour bands): 5-17,1
age_cldversion_y15_17,Age (Child labour bands): 15-17,2
age_cldversion_y5_11,Age (Child labour bands): 5-11,3
age_cldversion_y12_14,Age (Child labour bands): 1-14,4
age_ythadult_yge15,"Age (Youth, adults): 15+",5
age_ythadult_y15_64,"Age (Youth, adults): 15-64",6
age_ythadult_y15_24,"Age (Youth, adults): 15-24",7
age_ythadult_yge25,"Age (Youth, adults): 25+",8
age_ythbands_y15_29,Age (Youth bands): 15-29,9
age_ythbands_y15_19,Age (Youth bands): 15-19,10
age_ythbands_y20_24,Age (Youth bands): 20-24,11
age_ythbands_y25_29,Age (Youth bands): 25-29,12
age_aggregate_total,Age (Aggregate bands): Total,13
age_aggregate_ylt15,Age (Aggregate bands): <15,14
age_aggregate_y15_24,Age (Aggregate bands): 15-24,15
age_aggregate_y25_54,Age (Aggregate bands): 25-54,16
age_aggregate_y25_64,Age (Aggregate bands): 25-64,17
age_aggregate_y55_64,Age (Aggregate bands): 55-64,18
age_aggregate_yge65,Age (Aggregate bands): 65+,19
age_10yrbands_total,Age (10-year bands): Total,20
age_10yrbands_ylt15,Age (10-year bands): <15,21
age_10yrbands_y15_24,Age (10-year bands): 15-24,22
age_10yrbands_y25_34,Age (10-year bands): 25-34,23
age_10yrbands_y35_44,Age (10-year bands): 35-44,24
age_10yrbands_y45_54,Age (10-year bands): 45-54,25
age_10yrbands_y55_64,Age (10-year bands): 55-64,26
age_10yrbands_yge65,Age (10-year bands): 65+,27
age_5yrbands_total,Age (5-year bands): Total,28
age_5yrbands_y00_04,Age (5-year bands): 0-4,29
age_5yrbands_y05_09,Age (5-year bands): 5-9,30
age_5yrbands_y10_14,Age (5-year bands): 10-14,31
age_5yrbands_y15_19,Age (5-year bands): 15-19,32
age_5yrbands_y20_24,Age (5-year bands): 20-24,33
age_5yrbands_y25_29,Age (5-year bands): 25-29,34
age_5yrbands_y30_34,Age (5-year bands): 30-34,35
age_5yrbands_y35_39,Age (5-year bands): 35-39,36
age_5yrbands_y40_44,Age (5-year bands): 40-44,37
age_5yrbands_y45_49,Age (5-year bands): 45-49,38
age_5yrbands_y50_54,Age (5-year bands): 50-54,39
age_5yrbands_y55_59,Age (5-year bands): 55-59,40
age_5yrbands_y60_64,Age (5-year bands): 60-64,41
age_5yrbands_yge65,Age (5-year bands): 65+,42
edu_aggregate_total,Education (Aggregate levels): Total,43
edu_aggregate_ltb,Education (Aggregate levels): Less than basic,44
edu_aggregate_bas,Education (Aggregate levels): Basic,45
edu_aggregate_int,Education (Aggregate levels): Intermediate,46
edu_aggregate_adv,Education (Aggregate levels): Advanced,47
edu_aggregate_x,Education (Aggregate levels): Level not stated,48
edu_isced11_total,Education (ISCED-11): Total,49
edu_isced11_x,Education (ISCED-11): X. No schooling,50
edu_isced11_0,Education (ISCED-11): 0. Early childhood education,51
edu_isced11_1,Education (ISCED-11): 1. Primary education,52
edu_isced11_2,Education (ISCED-11): 2. Lower secondary education,53
edu_isced11_3,Education (ISCED-11): 3. Upper secondary education,54
edu_isced11_4,Education (ISCED-11): 4. Post-secondary non-tertiary education,55
edu_isced11_5,Education (ISCED-11): 5. Short-cycle tertiary education,56
edu_isced11_6,Education (ISCED-11): 6. Bachelor's or equivalent level,57
edu_isced11_7,Education (ISCED-11): 7. Master's or equivalent level,58
edu_isced11_8,Education (ISCED-11): 8. Doctoral or equivalent level,59
edu_isced11_9,Education (ISCED-11): 9. Not elsewhere classified,60
edu_isced97_total,Education (ISCED-97): Total,61
edu_isced97_x,Education (ISCED-97): X. No schooling,62
edu_isced97_0,Education (ISCED-97): 0. Pre-primary education,63
edu_isced97_1,Education (ISCED-97): 1. Primary education or first stage of basic education,64
edu_isced97_2,Education (ISCED-97): 2. Lower secondary or second stage of basic education,65
edu_isced97_3,Education (ISCED-97): 3. Upper secondary education,66
edu_isced97_4,Education (ISCED-97): 4. Post-secondary non-tertiary education,67
edu_isced97_5,Education (ISCED-97): 5. First stage of tertiary education (not leading directly to an advanced research qualification),68
edu_isced97_6,Education (ISCED-97): 6. Second stage of tertiary education (leading to an advanced research qualification),69
edu_isced97_unk,Education (ISCED-97): Level not stated,70
dsb_status_total,Disability status: Total,71
dsb_status_dis,Disability status: Persons with disability,72
dsb_status_nodis,Disability status: Persons without disability,73
mts_aggregate_total,Marital status (aggregate): Total,74
mts_aggregate_1,Marital status (aggregate): Single / Widowed / Divorced,75
mts_aggregate_2,Marital status (aggregate): Married / Union / Cohabiting,76
mts_aggregate_x,Marital status (aggregate): Not elsewhere classified,77
mts_details_total,Marital status (detailed): Total,78
mts_details_sgle,Marital status (detailed): Single,79
mts_details_mrd,Marital status (detailed): Married,80
mts_details_union,Marital status (detailed): Union / Cohabiting,81
mts_details_wid,Marital status (detailed): Widowed,82
mts_details_sep,Marital status (detailed): Divorced or legally separated,83
mts_details_x,Marital status (detailed): Not elsewhere classified,84
hht_aggregate_total,Household type: Total,85
hht_aggregate_o,Household type: One person,86
hht_aggregate_c,Household type: Couple without children,87
hht_aggregate_k,Household type: Couple with children,88
hht_aggregate_l,Household type: Lone parent,89
hht_aggregate_e,Household type: Extended family,90
cbr_bir_total,Place of birth: Total,91
cbr_bir_native,Place of birth: Native-born,92
cbr_bir_foreign,Place of birth: Foreign-born,93
cbr_bir_x,Place of birth: Status unknown,94
cbr_brt_total,Country of birth: Total,95
cbr_brt_afg,Country of birth: Afghanistan,96
cbr_brt_alb,Country of birth: Albania,97
cbr_brt_dza,Country of birth: Algeria,98
cbr_brt_asm,Country of birth: American Samoa,99
cbr_brt_ago,Country of birth: Angola,100
cbr_brt_arg,Country of birth: Argentina,101
cbr_brt_arm,Country of birth: Armenia,102
cbr_brt_aus,Country of birth: Australia,103
cbr_brt_aut,Country of birth: Austria,104
cbr_brt_aze,Country of birth: Azerbaijan,105
cbr_brt_bhs,Country of birth: Bahamas,106
cbr_brt_bhr,Country of birth: Bahrain,107
cbr_brt_bgd,Country of birth: Bangladesh,108
cbr_brt_blr,Country of birth: Belarus,109
cbr_brt_bel,Country of birth: Belgium,110
cbr_brt_blz,Country of birth: Belize,111
cbr_brt_ben,Country of birth: Benin,112
cbr_brt_btn,Country of birth: Bhutan,113
cbr_brt_bol,Country of birth: Bolivia,114
cbr_brt_bih,Country of birth: Bosnia and Herzegovina,115
cbr_brt_bwa,Country of birth: Botswana,116
cbr_brt_bra,Country of birth: Brazil,117
cbr_brt_brn,Country of birth: Brunei Darussalam,118
cbr_brt_bgr,Country of birth: Bulgaria,119
cbr_brt_bfa,Country of birth: Burkina Faso,120
cbr_brt_bdi,Country of birth: Burundi,121
cbr_brt_khm,Country of birth: Cambodia,122
cbr_brt_cmr,Country of birth: Cameroon,123
cbr_brt_can,Country of birth: Canada,124
cbr_brt_cpv,Country of birth: Cape Verde,125
cbr_brt_chl,Country of birth: Chile,126
cbr_brt_chn,Country of birth: China,127
cbr_brt_col,Country of birth: Colombia,128
cbr_brt_com,Country of birth: Comoros,129
cbr_brt_cog,Country of birth: Congo,130
cbr_brt_cod,"Country of birth: Congo, Democratic Republic of the",131
cbr_brt_cri,Country of birth: Costa Rica,132
cbr_brt_hrv,Country of birth: Croatia,133
cbr_brt_cub,Country of birth: Cuba,134
cbr_brt_cyp,Country of birth: Cyprus,135
cbr_brt_cze,Country of birth: Czech Republic,136
cbr_brt_civ,Country of birth: Côte d'Ivoire,137
cbr_brt_dnk,Country of birth: Denmark,138
cbr_brt_dji,Country of birth: Djibouti,139
cbr_brt_dom,Country of birth: Dominican Republic,140
cbr_brt_ecu,Country of birth: Ecuador,141
cbr_brt_egy,Country of birth: Egypt,142
cbr_brt_slv,Country of birth: El Salvador,143
cbr_brt_eri,Country of birth: Eritrea,144
cbr_brt_est,Country of birth: Estonia,145
cbr_brt_fji,Country of birth: Fiji,146
cbr_brt_fin,Country of birth: Finland,147
cbr_brt_fra,Country of birth: France,148
cbr_brt_gab,Country of birth: Gabon,149
cbr_brt_gmb,Country of birth: Gambia,150
cbr_brt_geo,Country of birth: Georgia,151
cbr_brt_deu,Country of birth: Germany,152
cbr_brt_gha,Country of birth: Ghana,153
cbr_brt_gib,Country of birth: Gibraltar,154
cbr_brt_grc,Country of birth: Greece,155
cbr_brt_gtm,Country of birth: Guatemala,156
cbr_brt_gin,Country of birth: Guinea,157
cbr_brt_gnb,Country of birth: Guinea-Bissau,158
cbr_brt_hti,Country of birth: Haiti,159
cbr_brt_hnd,Country of birth: Honduras,160
cbr_brt_hkg,"Country of birth: Hong Kong, China",161
cbr_brt_hun,Country of birth: Hungary,162
cbr_brt_ind,Country of birth: India,163
cbr_brt_idn,Country of birth: Indonesia,164
cbr_brt_irn,"Country of birth: Iran, Islamic Rep. of",165
cbr_brt_irq,Country of birth: Iraq,166
cbr_brt_irl,Country of birth: Ireland,167
cbr_brt_isr,Country of birth: Israel,168
cbr_brt_ita,Country of birth: Italy,169
cbr_brt_jam,Country of birth: Jamaica,170
cbr_brt_jpn,Country of birth: Japan,171
cbr_brt_jor,Country of birth: Jordan,172
cbr_brt_kaz,Country of birth: Kazakhstan,173
cbr_brt_ken,Country of birth: Kenya,174
cbr_brt_prk,"Country of birth: Korea, Dem. People's Rep. of",175
cbr_brt_kor,"Country of birth: Korea, Republic of",176
cbr_brt_kos,Country of birth: Kosovo,177
cbr_brt_kgz,Country of birth: Kyrgyzstan,178
cbr_brt_lao,Country of birth: Lao People's Dem. Rep.,179
cbr_brt_lva,Country of birth: Latvia,180
cbr_brt_lbn,Country of birth: Lebanon,181
cbr_brt_lbr,Country of birth: Liberia,182
cbr_brt_lby,Country of birth: Libyan Arab Jamahiriya,183
cbr_brt_ltu,Country of birth: Lithuania,184
cbr_brt_lux,Country of birth: Luxembourg,185
cbr_brt_mac,"Country of birth: Macau, China",186
cbr_brt_mkd,"Country of birth: Macedonia, The former Yugoslav Rep. of",187
cbr_brt_mdg,Country of birth: Madagascar,188
cbr_brt_mys,Country of birth: Malaysia,189
cbr_brt_mdv,Country of birth: Maldives,190
cbr_brt_mli,Country of birth: Mali,191
cbr_brt_mrt,Country of birth: Mauritania,192
cbr_brt_mex,Country of birth: Mexico,193
cbr_brt_mda,"Country of birth: Moldova, Republic of",194
cbr_brt_mng,Country of birth: Mongolia,195
cbr_brt_mne,Country of birth: Montenegro,196
cbr_brt_mar,Country of birth: Morocco,197
cbr_brt_moz,Country of birth: Mozambique,198
cbr_brt_mmr,Country of birth: Myanmar,199
cbr_brt_npl,Country of birth: Nepal,200
cbr_brt_nld,Country of birth: Netherlands,201
cbr_brt_nzl,Country of birth: New Zealand,202
cbr_brt_nic,Country of birth: Nicaragua,203
cbr_brt_ner,Country of birth: Niger,204
cbr_brt_nga,Country of birth: Nigeria,205
cbr_brt_nor,Country of birth: Norway,206
cbr_brt_pse,Country of birth: West Bank and Gaza Strip,207
cbr_brt_pak,Country of birth: Pakistan,208
cbr_brt_pan,Country of birth: Panama,209
cbr_brt_pry,Country of birth: Paraguay,210
cbr_brt_per,Country of birth: Peru,211
cbr_brt_phl,Country of birth: Philippines,212
cbr_brt_pol,Country of birth: Poland,213
cbr_brt_prt,Country of birth: Portugal,214
cbr_brt_rou,Country of birth: Romania,215
cbr_brt_rus,Country of birth: Russian Federation,216
cbr_brt_stp,Country of birth: Sao Tome and Principe,217
cbr_brt_sau,Country of birth: Saudi Arabia,218
cbr_brt_sen,Country of birth: Senegal,219
cbr_brt_srb,Country of birth: Serbia,220
cbr_brt_sle,Country of birth: Sierra Leone,221
cbr_brt_sgp,Country of birth: Singapore,222
cbr_brt_svk,Country of birth: Slovakia,223
cbr_brt_svn,Country of birth: Slovenia,224
cbr_brt_som,Country of birth: Somalia,225
cbr_brt_zaf,Country of birth: South Africa,226
cbr_brt_esp,Country of birth: Spain,227
cbr_brt_lka,Country of birth: Sri Lanka,228
cbr_brt_sdn,"Country of birth: Sudan, The Republic of",229
cbr_brt_swe,Country of birth: Sweden,230
cbr_brt_che,Country of birth: Switzerland,231
cbr_brt_syr,Country of birth: Syrian Arab Republic,232
cbr_brt_twn,"Country of birth: Taiwan, China",233
cbr_brt_tjk,Country of birth: Tajikistan,234
cbr_brt_tza,"Country of birth: Tanzania, United Republic of",235
cbr_brt_tha,Country of birth: Thailand,236
cbr_brt_tls,Country of birth: Timor-Leste,237
cbr_brt_tgo,Country of birth: Togo,238
cbr_brt_tun,Country of birth: Tunisia,239
cbr_brt_tur,Country of birth: Türkiye,240
cbr_brt_tkm,Country of birth: Turkmenistan,241
cbr_brt_uga,Country of birth: Uganda,242
cbr_brt_ukr,Country of birth: Ukraine,243
cbr_brt_are,Country of birth: United Arab Emirates,244
cbr_brt_gbr,Country of birth: United Kingdom,245
cbr_brt_usa,Country of birth: United States,246
cbr_brt_usacan,Country of birth: United States and Canada,247
cbr_brt_ury,Country of birth: Uruguay,248
cbr_brt_uzb,Country of birth: Uzbekistan,249
cbr_brt_ven,"Country of birth: Venezuela, Bolivarian Rep. of",250
cbr_brt_vnm,Country of birth: Viet Nam,251
cbr_brt_zmb,Country of birth: Zambia,252
cbr_brt_zwe,Country of birth: Zimbabwe,253
cbr_brt_asia,Country of birth: Asia,254
cbr_brt_cis,Country of birth: Commonwealth of Independent States,255
cbr_brt_eur,Country of birth: Europe,256
cbr_brt_x,Country of birth: Other countries,257
cct_cit_total,Citizenship: Total,258
cct_cit_citizen,Citizenship: National citizens,259
cct_cit_noncit,Citizenship: Foreign citizens,260
cct_cit_x,Citizenship: Status unknown,261
cct_ctz_total,Country of citizenship: Total,262
cct_ctz_afg,Country of citizenship: Afghanistan,263
cct_ctz_alb,Country of citizenship: Albania,264
cct_ctz_dza,Country of citizenship: Algeria,265
cct_ctz_asm,Country of citizenship: American Samoa,266
cct_ctz_and,Country of citizenship: Andorra,267
cct_ctz_ago,Country of citizenship: Angola,268
cct_ctz_arg,Country of citizenship: Argentina,269
cct_ctz_arm,Country of citizenship: Armenia,270
cct_ctz_aus,Country of citizenship: Australia,271
cct_ctz_aut,Country of citizenship: Austria,272
cct_ctz_aze,Country of citizenship: Azerbaijan,273
cct_ctz_bhs,Country of citizenship: Bahamas,274
cct_ctz_bhr,Country of citizenship: Bahrain,275
cct_ctz_bgd,Country of citizenship: Bangladesh,276
cct_ctz_brb,Country of citizenship: Barbados,277
cct_ctz_blr,Country of citizenship: Belarus,278
cct_ctz_bel,Country of citizenship: Belgium,279
cct_ctz_blz,Country of citizenship: Belize,280
cct_ctz_ben,Country of citizenship: Benin,281
cct_ctz_bmu,Country of citizenship: Bermuda,282
cct_ctz_btn,Country of citizenship: Bhutan,283
cct_ctz_bol,Country of citizenship: Bolivia,284
cct_ctz_bih,Country of citizenship: Bosnia and Herzegovina,285
cct_ctz_bwa,Country of citizenship: Botswana,286
cct_ctz_bra,Country of citizenship: Brazil,287
cct_ctz_vgb,Country of citizenship: British Virgin Islands,288
cct_ctz_brn,Country of citizenship: Brunei Darussalam,289
cct_ctz_bgr,Country of citizenship: Bulgaria,290
cct_ctz_bfa,Country of citizenship: Burkina Faso,291
cct_ctz_bdi,Country of citizenship: Burundi,292
cct_ctz_khm,Country of citizenship: Cambodia,293
cct_ctz_cmr,Country of citizenship: Cameroon,294
cct_ctz_can,Country of citizenship: Canada,295
cct_ctz_cpv,Country of citizenship: Cape Verde,296
cct_ctz_cym,Country of citizenship: Cayman Islands,297
cct_ctz_caf,Country of citizenship: Central African Republic,298
cct_ctz_tcd,Country of citizenship: Chad,299
cct_ctz_cha,Country of citizenship: Channel Islands,300
cct_ctz_chl,Country of citizenship: Chile,301
cct_ctz_chn,Country of citizenship: China,302
cct_ctz_col,Country of citizenship: Colombia,303
cct_ctz_com,Country of citizenship: Comoros,304
cct_ctz_cog,Country of citizenship: Congo,305
cct_ctz_cod,"Country of citizenship: Congo, Democratic Republic of the",306
cct_ctz_cok,Country of citizenship: Cook Islands,307
cct_ctz_cri,Country of citizenship: Costa Rica,308
cct_ctz_hrv,Country of citizenship: Croatia,309
cct_ctz_cub,Country of citizenship: Cuba,310
cct_ctz_cuw,Country of citizenship: Curaçao,311
cct_ctz_cyp,Country of citizenship: Cyprus,312
cct_ctz_cze,Country of citizenship: Czech Republic,313
cct_ctz_civ,Country of citizenship: Côte d'Ivoire,314
cct_ctz_dnk,Country of citizenship: Denmark,315
cct_ctz_dji,Country of citizenship: Djibouti,316
cct_ctz_dma,Country of citizenship: Dominica,317
cct_ctz_dom,Country of citizenship: Dominican Republic,318
cct_ctz_ecu,Country of citizenship: Ecuador,319
cct_ctz_egy,Country of citizenship: Egypt,320
cct_ctz_slv,Country of citizenship: El Salvador,321
cct_ctz_eri,Country of citizenship: Eritrea,322
cct_ctz_est,Country of citizenship: Estonia,323
cct_ctz_eth,Country of citizenship: Ethiopia,324
cct_ctz_flk,Country of citizenship: Falkland Islands (Malvinas),325
cct_ctz_fji,Country of citizenship: Fiji,326
cct_ctz_fin,Country of citizenship: Finland,327
cct_ctz_fra,Country of citizenship: France,328
cct_ctz_pyf,Country of citizenship: French Polynesia,329
cct_ctz_gab,Country of citizenship: Gabon,330
cct_ctz_gmb,Country of citizenship: Gambia,331
cct_ctz_geo,Country of citizenship: Georgia,332
cct_ctz_deu,Country of citizenship: Germany,333
cct_ctz_gha,Country of citizenship: Ghana,334
cct_ctz_gib,Country of citizenship: Gibraltar,335
cct_ctz_grc,Country of citizenship: Greece,336
cct_ctz_grl,Country of citizenship: Greenland,337
cct_ctz_grd,Country of citizenship: Grenada,338
cct_ctz_gum,Country of citizenship: Guam,339
cct_ctz_gtm,Country of citizenship: Guatemala,340
cct_ctz_gin,Country of citizenship: Guinea,341
cct_ctz_gnb,Country of citizenship: Guinea-Bissau,342
cct_ctz_guy,Country of citizenship: Guyana,343
cct_ctz_hti,Country of citizenship: Haiti,344
cct_ctz_hnd,Country of citizenship: Honduras,345
cct_ctz_hkg,"Country of citizenship: Hong Kong, China",346
cct_ctz_hun,Country of citizenship: Hungary,347
cct_ctz_isl,Country of citizenship: Iceland,348
cct_ctz_ind,Country of citizenship: India,349
cct_ctz_idn,Country of citizenship: Indonesia,350
cct_ctz_irn,"Country of citizenship: Iran, Islamic Rep. of",351
cct_ctz_irq,Country of citizenship: Iraq,352
cct_ctz_irl,Country of citizenship: Ireland,353
cct_ctz_isr,Country of citizenship: Israel,354
cct_ctz_ita,Country of citizenship: Italy,355
cct_ctz_jam,Country of citizenship: Jamaica,356
cct_ctz_jpn,Country of citizenship: Japan,357
cct_ctz_jor,Country of citizenship: Jordan,358
cct_ctz_kaz,Country of citizenship: Kazakhstan,359
cct_ctz_ken,Country of citizenship: Kenya,360
cct_ctz_kir,Country of citizenship: Kiribati,361
cct_ctz_prk,"Country of citizenship: Korea, Dem. People's Rep. of",362
cct_ctz_kor,"Country of citizenship: Korea, Republic of",363
cct_ctz_kos,Country of citizenship: Kosovo,364
cct_ctz_kwt,Country of citizenship: Kuwait,365
cct_ctz_kgz,Country of citizenship: Kyrgyzstan,366
cct_ctz_lao,Country of citizenship: Lao People's Dem. Rep.,367
cct_ctz_lva,Country of citizenship: Latvia,368
cct_ctz_lbn,Country of citizenship: Lebanon,369
cct_ctz_lso,Country of citizenship: Lesotho,370
cct_ctz_lbr,Country of citizenship: Liberia,371
cct_ctz_lby,Country of citizenship: Libyan Arab Jamahiriya,372
cct_ctz_lie,Country of citizenship: Liechtenstein,373
cct_ctz_ltu,Country of citizenship: Lithuania,374
cct_ctz_lux,Country of citizenship: Luxembourg,375
cct_ctz_mac,"Country of citizenship: Macau, China",376
cct_ctz_mkd,"Country of citizenship: Macedonia, The former Yugoslav Rep. of",377
cct_ctz_mdg,Country of citizenship: Madagascar,378
cct_ctz_mwi,Country of citizenship: Malawi,379
cct_ctz_mys,Country of citizenship: Malaysia,380
cct_ctz_mdv,Country of citizenship: Maldives,381
cct_ctz_mli,Country of citizenship: Mali,382
cct_ctz_mlt,Country of citizenship: Malta,383
cct_ctz_mhl,Country of citizenship: Marshall Islands,384
cct_ctz_mrt,Country of citizenship: Mauritania,385
cct_ctz_mus,Country of citizenship: Mauritius,386
cct_ctz_mex,Country of citizenship: Mexico,387
cct_ctz_mda,"Country of citizenship: Moldova, Republic of",388
cct_ctz_mco,Country of citizenship: Monaco,389
cct_ctz_mng,Country of citizenship: Mongolia,390
cct_ctz_mne,Country of citizenship: Montenegro,391
cct_ctz_msr,Country of citizenship: Montserrat,392
cct_ctz_mar,Country of citizenship: Morocco,393
cct_ctz_moz,Country of citizenship: Mozambique,394
cct_ctz_mmr,Country of citizenship: Myanmar,395
cct_ctz_nam,Country of citizenship: Namibia,396
cct_ctz_nru,Country of citizenship: Nauru,397
cct_ctz_npl,Country of citizenship: Nepal,398
cct_ctz_nld,Country of citizenship: Netherlands,399
cct_ctz_ncl,Country of citizenship: New Caledonia,400
cct_ctz_nzl,Country of citizenship: New Zealand,401
cct_ctz_nic,Country of citizenship: Nicaragua,402
cct_ctz_ner,Country of citizenship: Niger,403
cct_ctz_nga,Country of citizenship: Nigeria,404
cct_ctz_niu,Country of citizenship: Niue,405
cct_ctz_nfk,Country of citizenship: Norfolk Island,406
cct_ctz_nor,Country of citizenship: Norway,407
cct_ctz_pse,Country of citizenship: West Bank and Gaza Strip,408
cct_ctz_omn,Country of citizenship: Oman,409
cct_ctz_pak,Country of citizenship: Pakistan,410
cct_ctz_pan,Country of citizenship: Panama,411
cct_ctz_png,Country of citizenship: Papua New Guinea,412
cct_ctz_pry,Country of citizenship: Paraguay,413
cct_ctz_per,Country of citizenship: Peru,414
cct_ctz_phl,Country of citizenship: Philippines,415
cct_ctz_pol,Country of citizenship: Poland,416
cct_ctz_prt,Country of citizenship: Portugal,417
cct_ctz_pri,Country of citizenship: Puerto Rico,418
cct_ctz_qat,Country of citizenship: Qatar,419
cct_ctz_rou,Country of citizenship: Romania,420
cct_ctz_rus,Country of citizenship: Russian Federation,421
cct_ctz_rwa,Country of citizenship: Rwanda,422
cct_ctz_reu,Country of citizenship: Réunion,423
cct_ctz_kna,Country of citizenship: Saint Kitts and Nevis,424
cct_ctz_wsm,Country of citizenship: Samoa,425
cct_ctz_smr,Country of citizenship: San Marino,426
cct_ctz_sau,Country of citizenship: Saudi Arabia,427
cct_ctz_sen,Country of citizenship: Senegal,428
cct_ctz_srb,Country of citizenship: Serbia,429
cct_ctz_syc,Country of citizenship: Seychelles,430
cct_ctz_sle,Country of citizenship: Sierra Leone,431
cct_ctz_sgp,Country of citizenship: Singapore,432
cct_ctz_svk,Country of citizenship: Slovakia,433
cct_ctz_svn,Country of citizenship: Slovenia,434
cct_ctz_slb,Country of citizenship: Solomon Islands,435
cct_ctz_som,Country of citizenship: Somalia,436
cct_ctz_zaf,Country of citizenship: South Africa,437
cct_ctz_ssd,"Country of citizenship: South Sudan, The Republic of",438
cct_ctz_esp,Country of citizenship: Spain,439
cct_ctz_lka,Country of citizenship: Sri Lanka,440
cct_ctz_sdn,"Country of citizenship: Sudan, The Republic of",441
cct_ctz_sur,Country of citizenship: Suriname,442
cct_ctz_swz,Country of citizenship: Swaziland,443
cct_ctz_swe,Country of citizenship: Sweden,444
cct_ctz_che,Country of citizenship: Switzerland,445
cct_ctz_syr,Country of citizenship: Syrian Arab Republic,446
cct_ctz_twn,"Country of citizenship: Taiwan, China",447
cct_ctz_tjk,Country of citizenship: Tajikistan,448
cct_ctz_tza,"Country of citizenship: Tanzania, United Republic of",449
cct_ctz_tha,Country of citizenship: Thailand,450
cct_ctz_tls,Country of citizenship: Timor-Leste,451
cct_ctz_tgo,Country of citizenship: Togo,452
cct_ctz_tkl,Country of citizenship: Tokelau,453
cct_ctz_ton,Country of citizenship: Tonga,454
cct_ctz_tto,Country of citizenship: Trinidad and Tobago,455
cct_ctz_tun,Country of citizenship: Tunisia,456
cct_ctz_tur,Country of citizenship: Türkiye,457
cct_ctz_tkm,Country of citizenship: Turkmenistan,458
cct_ctz_tuv,Country of citizenship: Tuvalu,459
cct_ctz_uga,Country of citizenship: Uganda,460
cct_ctz_ukr,Country of citizenship: Ukraine,461
cct_ctz_are,Country of citizenship: United Arab Emirates,462
cct_ctz_gbr,Country of citizenship: United Kingdom,463
cct_ctz_usa,Country of citizenship: United States,464
cct_ctz_ury,Country of citizenship: Uruguay,465
cct_ctz_uzb,Country of citizenship: Uzbekistan,466
cct_ctz_vut,Country of citizenship: Vanuatu,467
cct_ctz_ven,"Country of citizenship: Venezuela, Bolivarian Rep. of",468
cct_ctz_vnm,Country of citizenship: Viet Nam,469
cct_ctz_wlf,Country of citizenship: Wallis and Futuna Islands,470
cct_ctz_esh,Country of citizenship: Western Sahara,471
cct_ctz_yem,Country of citizenship: Yemen,472
cct_ctz_zmb,Country of citizenship: Zambia,473
cct_ctz_zwe,Country of citizenship: Zimbabwe,474
cct_ctz_asia,Country of citizenship: Asia,475
cct_ctz_baltic,Country of citizenship: Baltics,476
cct_ctz_cis,Country of citizenship: Commonwealth of Independent States,477
cct_ctz_eur,Country of citizenship: Europe,478
cct_ctz_amen,Country of citizenship: North America,479
cct_ctz_oce,Country of citizenship: Oceania,480
cct_ctz_xasia,Country of citizenship: Rest of Asia,481
cct_ctz_x,Country of citizenship: Other countries,482
geo_cov_nat,Area type: National,483
geo_cov_rur,Area type: Rural,484
geo_cov_urb,Area type: Urban,485
geo_cov_x,Area type: Not elsewhere classified,486
ste_aggregate_total,Status in employment (Aggregate): Total,487
ste_aggregate_ees,Status in employment (Aggregate): Employees,488
ste_aggregate_slf,Status in employment (Aggregate): Self-employed,489
ste_aggregate_x,Status in employment (Aggregate): Workers not classifiable by status,490
ste_icse93_total,Status in employment (ICSE-93): Total,491
ste_icse93_1,Status in employment (ICSE-93): 1. Employees,492
ste_icse93_2,Status in employment (ICSE-93): 2. Employers,493
ste_icse93_3,Status in employment (ICSE-93): 3. Own-account workers,494
ste_icse93_4,Status in employment (ICSE-93): 4. Members of producers' cooperatives,495
ste_icse93_5,Status in employment (ICSE-93): 5. Contributing family workers,496
ste_icse93_6,Status in employment (ICSE-93): 6. Workers not classifiable by status,497
eco_agnag_total,"Economic activity (Agriculture, Non-Agriculture): Total",498
eco_agnag_agr,"Economic activity (Agriculture, Non-Agriculture): Agriculture",499
eco_agnag_nag,"Economic activity (Agriculture, Non-Agriculture): Non-agriculture",500
eco_sector_total,Economic activity (Broad sector): Total,501
eco_sector_agr,Economic activity (Broad sector): Agriculture,502
eco_sector_nag,Economic activity (Broad sector): Non-agriculture,503
eco_sector_ind,Economic activity (Broad sector): Industry,504
eco_sector_ser,Economic activity (Broad sector): Services,505
eco_sector_x,Economic activity (Broad sector): Not classified,506
eco_aggregate_total,Economic activity (Aggregate): Total,507
